{
  "schema_version": 1,
  "application_id": "application-1",
  "status": "applied",
  "skill_id": "skill.basic_motion",
  "skill_version": 1,
  "composition_policy": "ordered",
  "application_context": { "aspect_ratio": "9:16" },
  "base_timeline_version": 0,
  "final_timeline_version": 1,
  "selection_hash": "aaaaaaaaaaaaaaaaaaaaaaaaaaaaaaaaaaaaaaaaaaaaaaaaaaaaaaaaaaaaaaaa",
  "command_hash": "bbbbbbbbbbbbbbbbbbbbbbbbbbbbbbbbbbbbbbbbbbbbbbbbbbbbbbbbbbbbbbbb",
  "semantic_expectation_hash": "cccccccccccccccccccccccccccccccccccccccccccccccccccccccccccccccc",
  "selections": [{ "schema_version": 1, "selection_id": "selection-1", "preset_id": "motion.static_transform", "preset_version": 1, "parameters": { "x": 0.25 }, "bindings": { "track_id": "v1", "clip_id": "clip-1" } }],
  "resolved_selections": [{ "selection_id": "selection-1", "definition": { "preset_id": "motion.static_transform", "preset_version": 1, "definition_digest": "dddddddddddddddddddddddddddddddddddddddddddddddddddddddddddddddd" }, "parameters": { "x": 0.25 }, "bindings": { "track_id": "v1", "clip_id": "clip-1" } }],
  "command_payload": "[{\"type\":\"set_transform\"}]",
  "definition_pins": [{ "preset_id": "motion.static_transform", "preset_version": 1, "definition_digest": "dddddddddddddddddddddddddddddddddddddddddddddddddddddddddddddddd" }],
  "policy_decisions": [{ "selection_id": "selection-1", "policy": "trust", "subject": "dddddddddddddddddddddddddddddddddddddddddddddddddddddddddddddddd", "outcome": "approved", "detail": "built_in" }],
  "routing_decisions": [{ "selection_id": "selection-1", "semantic_id": "transform", "capability": "timeline.transform", "target": "preview", "outcome": "execute" }],
  "render_validation": { "semantic_graph_hash": "ffffffffffffffffffffffffffffffffffffffffffffffffffffffffffffffff", "preview_decisions": [{ "schema_version": 1, "node_id": "clip-1-transform", "capability": "timeline.transform", "outcome": "execute" }], "master_decisions": [{ "schema_version": 1, "node_id": "clip-1-transform", "capability": "timeline.transform", "outcome": "execute" }], "semantic_links": [{ "selection_id": "selection-1", "semantic_id": "transform", "target": "preview", "declared_outcome": "execute", "declared_capability": "timeline.transform", "actual_capability": "timeline.transform", "actual_node_ids": ["clip-1-transform"] }] },
  "diagnostics": [],
  "commit_plan_hash": "eeeeeeeeeeeeeeeeeeeeeeeeeeeeeeeeeeeeeeeeeeeeeeeeeeeeeeeeeeeeeeee",
  "attribution": []
}
